{
  "$schema": "./manifest.schema.json",
  "manifest": "feature-loop",
  "description": "Full feature work (was >>jira / >>specify -> >>implement -> >>review -> >>quality -> >>deliver). Spec-gated, verified, human-merged; budget 3 = the one review-cycle budget.",
  "states": ["PLANNING", "IMPLEMENTING", "REVIEWING", "QUALITY", "DELIVERING"],
  "budget": 3,
  "skills": ["glossary-protocol", "clippy-tdd", "grounding", "scope-guard", "commit-convention", "decision-routing"],
  "bind": {
    "onEnter:PLANNING": ["brainstorm"],
    "onEnter:IMPLEMENTING": ["agent-implement"],
    "onEnter:REVIEWING": ["spec-conformance", "security-review"],
    "onEnter:QUALITY": ["quality-gate"],
    "onEnter:DELIVERED": ["domain-accretion"]
  }
}
